pap_id,sci_name,other_name,native_place,general,shoot,leaf,flower,bloom,nature
12,Paphiopedilum appletonianum,รองเท้านารีคางกบคอแดง,มีการกระจายพันธ์ทางภาคตะวันออกของไทย ลาว กัมพูชา เวียดนาม และทางตอนเหนือของจีน ซึ่งสูงจากน้ำทะเล 600-2000 เมตร,มีการเจริญเติบโตแบบพืชอาศัยบนดิน,มีพุ่มใบขนาด 10-15 ซม.,เป็นรูปรีแกมรูปขอบขนานกว้าง 2.4-4 ซม. ยาว 7-23 ซม. แผ่นใบเป็นลายกินอ่อนสีเขียวคล้ำสลับเขียวอ่อน โคนกาบใบมีสีม่วงเรื่อๆ และมีขอบใบงุ้มลง ,เป็นดอกเดี่ยว ก้านดอกตั้งตรงสีม่วงยาว 17-60 ซม. มีขนสั้นปกคลุมเมื่อดอกบานเต็มที่มีขนาด 3.5-6.5 ซม. กลีบนอกบนงุ้มมาด้านหน้า มีสีเขียว โดนกลีบมีเส้นริ้วสีน้ำตาลแดงเรื่อ กลีบดอกอยู่ในแนวระนาบ โคนกลีบห่อเล็กน้อย มีสีเขียวขอบกลีบบนย่น และมีไฝสีน้ำตาลแดง 5-6 จุด กึ่งกลางปลายกลีบสีชมพู กระเป๋ามีสีน้ำตาลแดงเรื่อขลิบสีเขียวอมเหลือง โล่สีเหลืองอมเขียว รูปทรงคล้ายรูปไต ขนาด 0.8-1 ซม. กึ่งกลางมีสีเขียวเข้ม ด้านบนหยักเป็นร่อง ด้านล่างหยักเว้าเป็นเขี้ยว,มกราคม-มีนาคม,ชอบอากาศค่อนข้างเย็น  แข็งแรง และแตกหน่อได้ดี เมื่อกำลังออกดอกควรให้มีแสงรำไร จะช่วยให้สีดอกดูสดใสขึ้น
13,Paphiopedilum callosum,"รองเท้าคางกบ รองเท้านารีไทยแลนด์
รองเท้านารีแมลงภู่(ลำปาง) เอื้องคางคก เอื้องคางกบ(เชียงใหม่)
",มีการกระจายพันธุ์ในลาว เวียดนาม กัมพูชา ไทย และทางตะวันตกเฉียงเหนือของมาเลเซีย ซึ่งสูงจากระดับน้ำทะเล 700-950 เมตร,มีการเจริญเติบโตแบบพืชอาศัยบนดิน   ต้น มีพุ่มใบขนาด 18-20 ซม.,มีพุ่มใบขนาด 18-20 ซม.,เป็นรูปขอบขนานแกมรูปรี กว้าง 3-3.5 ซม. ยาว 15-18 ซม. แผ่นใบลายตารางสีเขียวเข็มสลับเขียวเทาหรือเป็นแต้มไม่ชัดเจนนัก กาบใบที่โคนต้นมีขนปกคลุมเล็กน้อย,เป็นดอกเดี่ยว มี 1-2 ดอกต่อต้น ก้านดอกตั้งตรงสีม่วงเข้ม ยาว 25-30 ซม. และมีขนปกคลุม เมื่อดอกบานเต็มที่มีขนาด 6-8 ซม. กลีบนอกบนบิดเล็กน้อย มีสีขาว และเส้นริ้วสีเขียวจำนวนมาก ปลายริ้วสีม่วง กลีบดอกชี้เป็นมุม 45 องศา กับแนวระนาบ มักบิดและห่อไปด้านหลัง โคนกลีบมีสีเขียวเรื่อ ขอบกลีบบนมีไฝสีน้ำตาลแดง 5-6จุดและมีขนยาวปกคลุม กระเป๋ามีสีม่วงแดงเรื่อ และเส้นร่างแหสีน้ำตาลแดง โล่สีขาวนวล รูปทรงคล้ายรูปเกือกม้า ขนาด 1 เซ็นกึ่งกลางมีแต้มสีน้ำตาลเข้ม ด้านบนหยักเล็กน้อยและงุ้มมาข้างหน้า ด้านล่างหยักเป็นเขี้ยว,กรกฏาคม - สิงหาคม,ชอบอากาศเย็น ปลูกเลี้ยงง่าย แตกหน่อเร็ว สามารถปลูกเป็นไม้กระถางในบ้าน
14,"Paphiopedilum 
sukhakulii
","รองเท้านารี
สุขะกูล
รองเท้านารีปีกแมลงปอ
",มีการกระจายพันธุ์ทางตะวันออกเฉียงเหนือของไทยที่ภูหลวง จังหวัดเลย ซึ่งสูงจากระดับน้ำทะเลกว่า 1000 เมตร,มีการเจริญเติบโตแบบพืชอาศัยบนดิน,มีพุ่มใบขนาด 15-18 ซม.,รูปรีแก้มขอบขนาน กว้าง 3-3.5 ซม. ยาว 12-15 ซม. แผ่นใบแข็งหยาบ เป็นลายหินอ่อนสีเขียวสลับเขียวเทา โคนกาบใบมีจุดสีม่วงแดงกระจายหนาแน่น,เป็นดอกเดี่ยว ก้านดอกตั้งตรงสีม่วงแดง ยาว 12-15 ซม. และมีขนสั้นปกคลุม เมื่อดอกบานเต็มที่มีขนาด 8-10 ซม. กลีบนอกบนมีสีขาวและเส้นริ้วสีเขียวจำนวนมาก กลีบดอกอยู่ในแนวระนาบมีสีเขียวอ่อน เส้นริ้วสีเขียวและแต้มสีม่วงแดงกระจายทั่วกลีบ ขอบกลีบมีขนยาวสีม่วงแดงปกคลุม กระเป๋าสีเขียว โล่สีขาวนวล รูปทรงคล้ายรูปเกือกม้า ขนาด 1-1.2 ซม. กึ่งกลางมีเส้นร่างแหสีเขียว ด้านล่างเป็นหยักเขี้ยว,กันยายน-ธันวาคม,ชอบอากาศเย็น และความชื้นในอากาศสูง เลี้ยงและให้ดอกยาก ปลูกเลี้ยงได้ดีในภาคอีสานตอนบน
